{
  "id": "source.synthetic.release-001",
  "type": "Source",
  "title": "Synthetic Runtime Release Note",
  "source_class": "PRIMARY",
  "url": "https://example.org/releases/runtime-1",
  "published_at": "2026-09-01",
  "retrieved_at": "2026-09-04",
  "notes": "Synthetic public example; not a real product claim."
}
